Business Name,Contact Info
Tesla USA,(877) 798-3752
Microsoft,"We'll show you self-help options first. Additional help is available if you need it, including live chat with a Microsoft specialist. Microsoft 365. Office."
apple,You can talk to an Apple Advisor by calling the Apple Support phone number for your country or region.
BYD,"BYD North America LLC 888 E. Walnut St. Pasadena, CA 91101 213-748-3980 marketing.us@byd.com Don't Miss Out! Get the Latest News About BYD"
Tesla USA,"For support with Powerwall, Solar Panels, Solar Roof and other energy products, call our Customer Support team toll free at (877) 798-3752 and select option 4, ..."
SpaceX USA,"SpaceX designs, manufactures and launches advanced rockets and spacecraft. The company was founded in 2002 to revolutionize space technology, ..."
NVIDIA USA,"More than 50 offices worldwide. NVIDIA Corporate 2788 San Tomas Expressway Santa Clara, CA 95051 View Directions Map View Campus Map Tel: +1 (408) 486-2000 ..."
Netflix USA,"Visit the Help Center for more info or contact us. If you have a request for ... Netflix, Inc. 121 Albright Way Los Gatos, CA 95032, USA. Data ..."
OpenAI USA,Contacting Support. You can contact OpenAI Support by opening the chat bubble icon displayed at the bottom-right of help.openai.com.
Google USA,"Ask questions or report an issue with a Google product or service. · If you're a member of the press, email us at press@google.com · Learn more about our teams ..."
Amazon USA,"Visit the Amazon Customer Service site to find answers to common problems, use online chat, or call customer service phone number at 1-888-280-4331 for ..."
Meta USA,No information is available for this page.
